{
  "schema_version": 1,
  "kind": "desktop.support_window",
  "decision_status": "approved",
  "published": "2026-10-22",
  "source_of_truth": "verdictan/cli/docs/contracts",
  "protocol": {
    "current": 1,
    "supported": [
      1
    ],
    "versions": [
      {
        "version": 1,
        "introduced_in_runtime": "0.1.0",
        "deprecated": null,
        "end_of_support": null,
        "contracts": [
          {
            "schema": "auth-desktop.request.v1.schema.json",
            "fixtures": [
              {
                "file": "fixtures/auth-desktop.requests.json"
              },
              {
                "file": "fixtures/project-services.requests.json"
              }
            ]
          },
          {
            "schema": "auth-desktop.event.v1.schema.json",
            "fixtures": [
              {
                "file": "fixtures/auth-desktop.events.json"
              },
              {
                "file": "fixtures/claude-subscription.provisioned.json"
              },
              {
                "file": "fixtures/claude-subscription.errors.json",
                "pointer": "/errors"
              }
            ]
          },
          {
            "schema": "auth-desktop.protected-credentials.v1.schema.json",
            "fixtures": []
          },
          {
            "schema": "gateway-supervise.request.v1.schema.json",
            "fixtures": [
              {
                "file": "fixtures/gateway-supervise.requests.json"
              }
            ]
          },
          {
            "schema": "gateway-supervise.event.v1.schema.json",
            "fixtures": [
              {
                "file": "fixtures/gateway-supervise.events.json"
              }
            ]
          },
          {
            "schema": "desktop-gateway-readiness.v1.schema.json",
            "fixtures": [
              {
                "file": "fixtures/desktop-gateway-readiness.json"
              }
            ]
          },
          {
            "schema": "desktop-gateway-events.v1.schema.json",
            "fixtures": [
              {
                "file": "fixtures/desktop-gateway-events.json"
              }
            ]
          },
          {
            "schema": "desktop-snapshot.v1.schema.json",
            "fixtures": [
              {
                "file": "fixtures/desktop-snapshot.json"
              }
            ]
          },
          {
            "schema": "desktop-release-manifest.v1.schema.json",
            "fixtures": [
              {
                "file": "fixtures/desktop-release-manifest.json"
              }
            ]
          },
          {
            "schema": "desktop-release-feed.v1.schema.json",
            "fixtures": [
              {
                "file": "fixtures/desktop-release-feed.json"
              }
            ]
          },
          {
            "schema": "desktop-release-pins.v1.schema.json",
            "fixtures": [
              {
                "file": "fixtures/desktop-release-pins.json"
              }
            ]
          },
          {
            "schema": "desktop-update-operation.v1.schema.json",
            "fixtures": [
              {
                "file": "fixtures/desktop-update-operations.json"
              }
            ]
          },
          {
            "schema": "desktop-process-inventory.v1.schema.json",
            "fixtures": [
              {
                "file": "fixtures/desktop-process-inventory.json"
              }
            ]
          },
          {
            "schema": "desktop-conversation-binding.v1.schema.json",
            "fixtures": [
              {
                "file": "fixtures/desktop-conversation-binding.json"
              }
            ]
          },
          {
            "schema": "desktop-resume-result.v1.schema.json",
            "fixtures": [
              {
                "file": "fixtures/desktop-resume-result.json"
              }
            ]
          },
          {
            "schema": "desktop-support-bundle.v1.schema.json",
            "fixtures": [
              {
                "file": "fixtures/desktop-support-bundle.json"
              }
            ]
          }
        ]
      }
    ]
  },
  "runtime": {
    "policy": "The current release and the two releases before it.",
    "minimum": "0.6.9",
    "newest_verified": "0.6.11",
    "setup_minimum": "0.6.6",
    "deprecation_notice_days": 90,
    "capabilities_fixture": "fixtures/runtime-capabilities.json",
    "versions": [
      {
        "version": "0.6.9",
        "protocol": 1,
        "contracts_sha256": "3999ff850c3a5b44f57f535cdca5ebf496e482cb3a2046770456e69384a1d303",
        "snapshot": "releases/0.6.10/"
      },
      {
        "version": "0.6.10",
        "protocol": 1,
        "contracts_sha256": "3999ff850c3a5b44f57f535cdca5ebf496e482cb3a2046770456e69384a1d303",
        "snapshot": "releases/0.6.10/"
      },
      {
        "version": "0.6.11",
        "protocol": 1,
        "contracts_sha256": "55f202c8f27ef7d8c12222d4f46cb68a4c2f5ea140e3b3b909d2503b59bb9dd8"
      }
    ],
    "deprecations": [
      {
        "versions": {
          "minimum": "0.0.0",
          "maximum": "0.6.7"
        },
        "reason": "These releases are older than the support window. Releases before 0.6.6 cannot run the Kalkidan setup, because they have no setup.bootstrap. 0.6.6 refuses native agent versions that its release evidence did not test.",
        "replacement": "0.6.9",
        "deprecated": "2026-10-22",
        "end_of_support": "2027-01-20"
      },
      {
        "versions": {
          "minimum": "0.6.8",
          "maximum": "0.6.8"
        },
        "reason": "This release is older than the support window.",
        "replacement": "0.6.9",
        "deprecated": "2026-10-22",
        "end_of_support": "2027-01-20"
      }
    ]
  },
  "desktop": {
    "minimum": "0.1.0"
  },
  "agents": {
    "owner": "kalkidan",
    "codex": "0.160.0",
    "claude_code": "2.1.300"
  }
}
